<?xml version="1.0" encoding="UTF-8"?>
<!--
    Schema for equilibrium.xml: GSFit's own settings, which make the equilibrium IDS.

    The root element is `equilibrium_settings`, the IDS's name followed by `_settings`.
    equilibrium.xml holds no settings itself. It links to the files which do, one element per file, with
    the file's path in `href`, relative to equilibrium.xml.
    See ../GSFIT_code_settings.xsd for the conventions shared by all the schemas.
-->
<xs:schema xmlns:xs="http://www.w3.org/2001/XMLSchema" elementFormDefault="unqualified">

    <!-- ================================= Types ================================= -->

    <xs:simpleType name="XmlPath">
        <xs:annotation>
            <xs:documentation>
                Path of an XML file, relative to the file holding the link.
            </xs:documentation>
        </xs:annotation>
        <xs:restriction base="xs:anyURI">
            <xs:pattern value="\S+\.xml"/>
        </xs:restriction>
    </xs:simpleType>

    <xs:complexType name="Link">
        <xs:annotation>
            <xs:documentation>
                A link to the file holding these settings.
            </xs:documentation>
        </xs:annotation>
        <xs:attribute name="href" type="XmlPath" use="required">
            <xs:annotation>
                <xs:documentation>
                    Path of the linked file, relative to equilibrium.xml, e.g. "numerics.xml" or "../../default/equilibrium/numerics.xml".
                </xs:documentation>
            </xs:annotation>
        </xs:attribute>
    </xs:complexType>

    <xs:complexType name="EquilibriumConstraints">
        <xs:annotation>
            <xs:documentation>
                The constraints, named as in the IMAS Data Dictionary. Each links to a file whose root element is the link's path with `__` for `/`, e.g. `constraints__flux_loop`.
            </xs:documentation>
        </xs:annotation>
        <xs:all>
            <xs:element name="b_field_pol_probe" type="Link">
                <xs:annotation>
                    <xs:documentation>
                        How each poloidal field probe (Mirnov coil) is fitted.
                    </xs:documentation>
                    <xs:appinfo>
                        <schema>constraints_b_field_pol_probe.xsd</schema>
                    </xs:appinfo>
                </xs:annotation>
            </xs:element>
            <xs:element name="flux_loop" type="Link">
                <xs:annotation>
                    <xs:documentation>
                        How each flux loop is fitted.
                    </xs:documentation>
                    <xs:appinfo>
                        <schema>constraints_flux_loop.xsd</schema>
                    </xs:appinfo>
                </xs:annotation>
            </xs:element>
            <xs:element name="rogowski_coil" type="Link">
                <xs:annotation>
                    <xs:documentation>
                        How each Rogowski coil is fitted.
                    </xs:documentation>
                    <xs:appinfo>
                        <schema>constraints_rogowski_coil.xsd</schema>
                    </xs:appinfo>
                </xs:annotation>
            </xs:element>
            <xs:element name="diamagnetic_flux" type="Link">
                <xs:annotation>
                    <xs:documentation>
                        How the diamagnetic loop is fitted.
                    </xs:documentation>
                    <xs:appinfo>
                        <schema>constraints_diamagnetic_flux.xsd</schema>
                    </xs:appinfo>
                </xs:annotation>
            </xs:element>
            <xs:element name="isoflux" type="Link">
                <xs:annotation>
                    <xs:documentation>
                        The isoflux constraints: pairs of points on the same flux surface.
                    </xs:documentation>
                    <xs:appinfo>
                        <schema>constraints_isoflux.xsd</schema>
                    </xs:appinfo>
                </xs:annotation>
            </xs:element>
            <xs:element name="pressure" type="Link">
                <xs:annotation>
                    <xs:documentation>
                        How pressure sensors are fitted.
                    </xs:documentation>
                    <xs:appinfo>
                        <schema>constraints_pressure.xsd</schema>
                    </xs:appinfo>
                </xs:annotation>
            </xs:element>
        </xs:all>
    </xs:complexType>

    <!-- ================================= The settings file ================================= -->

    <xs:element name="equilibrium_settings">
        <xs:annotation>
            <xs:documentation>
                Settings to make the equilibrium IDS.
            </xs:documentation>
        </xs:annotation>
        <xs:complexType>
            <xs:all>
                <!-- Code settings -->
                <xs:element name="timeslices" type="Link">
                    <xs:annotation>
                        <xs:documentation>
                            The times to reconstruct.
                        </xs:documentation>
                        <xs:appinfo>
                            <schema>timeslices.xsd</schema>
                        </xs:appinfo>
                    </xs:annotation>
                </xs:element>
                <xs:element name="numerics" type="Link">
                    <xs:annotation>
                        <xs:documentation>
                            Settings for the Grad-Shafranov solve, and the number of threads it runs on.
                        </xs:documentation>
                        <xs:appinfo>
                            <schema>numerics.xsd</schema>
                        </xs:appinfo>
                    </xs:annotation>
                </xs:element>
                <xs:element name="grid" type="Link">
                    <xs:annotation>
                        <xs:documentation>
                            The (R, Z) grid the equilibrium is solved on, and the psi_norm grid of the 1D profiles.
                        </xs:documentation>
                        <xs:appinfo>
                            <schema>grid.xsd</schema>
                        </xs:appinfo>
                    </xs:annotation>
                </xs:element>
                <xs:element name="initial_guess" type="Link">
                    <xs:annotation>
                        <xs:documentation>
                            Initial guess for first iteration.
                        </xs:documentation>
                        <xs:appinfo>
                            <schema>initial_guess.xsd</schema>
                        </xs:appinfo>
                    </xs:annotation>
                </xs:element>

                <!-- Source functions -->
                <xs:element name="source_function_p_prime" type="Link">
                    <xs:annotation>
                        <xs:documentation>
                            The p' source function: its basis functions and their regularisation.
                        </xs:documentation>
                        <xs:appinfo>
                            <schema>source_function_p_prime.xsd</schema>
                        </xs:appinfo>
                    </xs:annotation>
                </xs:element>
                <xs:element name="source_function_ff_prime" type="Link">
                    <xs:annotation>
                        <xs:documentation>
                            The ff' source function: its basis functions and their regularisation.
                        </xs:documentation>
                        <xs:appinfo>
                            <schema>source_function_ff_prime.xsd</schema>
                        </xs:appinfo>
                    </xs:annotation>
                </xs:element>

                <!-- Passive structures -->
                <xs:element name="pf_passive_dof" type="Link">
                    <xs:annotation>
                        <xs:documentation>
                            The degrees of freedom of the currents in the passive structures, and their regularisation.
                        </xs:documentation>
                        <xs:appinfo>
                            <schema>pf_passive_dof.xsd</schema>
                        </xs:appinfo>
                    </xs:annotation>
                </xs:element>

                <!-- Constraints -->
                <xs:element name="constraints" type="EquilibriumConstraints">
                    <xs:annotation>
                        <xs:documentation>
                            Constraints used in the least-squares fit.
                        </xs:documentation>
                    </xs:annotation>
                </xs:element>
            </xs:all>
        </xs:complexType>
    </xs:element>
</xs:schema>
